<?xml version="1.0" encoding="UTF-8"?>
<xs:schema xmlns:xs="http://www.w3.org/2001/XMLSchema" elementFormDefault="qualified"
           targetNamespace="http://tokenscript.org/2019/05/tokenscript"
           xmlns:xhtml="http://www.w3.org/1999/xhtml"
           xmlns="http://tokenscript.org/2019/05/tokenscript">


  <!-- Importing XML namespace for xml:lang and xml:id -->
  <xs:import namespace="http://www.w3.org/XML/1998/namespace"
        schemaLocation="xml.xsd" />

  <!-- Importing XML Signature namespace. Schema is from
      http://www.w3.org/TR/2008/REC-xmldsig-core-20080610/xmldsig-core-schema.xsd
  -->
  <xs:import namespace="http://www.w3.org/2000/09/xmldsig#"
        schemaLocation="xmldsig-core-schema.xsd" />

  <!-- Importing XHTML namespace. use xhtml1-strict.xsd to get xhtml:Block -->
  <xs:import namespace="http://www.w3.org/1999/xhtml"
             schemaLocation="xhtml1-strict.xsd"/>
  <xs:element name="token">
    <xs:complexType>
      <xs:sequence>
        <xs:element ref="name"/>
        <xs:element minOccurs="0" maxOccurs="unbounded" ref="contract"/>
        <xs:element ref="origins"/>
        <xs:element minOccurs="0" ref="selections"/>
        <xs:element ref="cards"/>
        <xs:element minOccurs="0" ref="grouping"/>
        <xs:element minOccurs="0" ref="ordering"/>
        <xs:element ref="attribute-types"/>
      </xs:sequence>
      <xs:attribute name="custodian" type="xs:boolean"/>
    </xs:complexType>
  </xs:element>
  <xs:element name="name" type="text"/>
  <xs:complexType name="text" mixed="true">
    <xs:sequence>
      <xs:element minOccurs="0" maxOccurs="unbounded" ref="plurals"/>
      <xs:element minOccurs="0" maxOccurs="unbounded" ref="string"/>
    </xs:sequence>
  </xs:complexType>
  <xs:element name="plurals">
    <xs:complexType>
      <xs:sequence>
        <xs:element maxOccurs="unbounded" ref="string"/>
      </xs:sequence>
      <xs:attribute use="required" ref="xml:lang"/>
    </xs:complexType>
  </xs:element>
  <xs:element name="string">
    <xs:complexType>
      <xs:simpleContent>
        <xs:extension base="xs:string">
          <xs:attribute ref="xml:lang"/>
          <xs:attribute name="quantity" type="quantity"/>
        </xs:extension>
      </xs:simpleContent>
    </xs:complexType>
  </xs:element>
  <xs:simpleType name="quantity">
    <xs:restriction base="xs:string">
      <xs:enumeration value="zero" />
      <xs:enumeration value="one" />
      <xs:enumeration value="two" />
      <xs:enumeration value="few" />
      <xs:enumeration value="many" />
      <xs:enumeration value="other" />
    </xs:restriction>
  </xs:simpleType>
  <xs:element name="contract">
    <xs:complexType>
      <xs:sequence>
        <xs:element maxOccurs="unbounded" name="address">
          <xs:complexType mixed="true">
            <xs:attribute name="network" use="required" type="xs:integer"/>
          </xs:complexType>
        </xs:element>
        <xs:element minOccurs="0" ref="interface"/>
      </xs:sequence>
      <xs:attribute name="name" type="xs:ID"/>
      <xs:attribute name="interface" type="xs:NCName"/>
    </xs:complexType>
  </xs:element>
  <xs:element name="interface" type="xs:NCName"/>
  <xs:element name="cards">
    <xs:complexType>
      <xs:sequence>
        <xs:element ref="token-card"/>
        <xs:element minOccurs="0" maxOccurs="unbounded" ref="action"/>
      </xs:sequence>
    </xs:complexType>
  </xs:element>
  <xs:element name="token-card">
    <xs:complexType>
      <xs:sequence>
        <xs:element minOccurs="0" ref="xhtml:style"/>
        <xs:element ref="view-iconified"/>
        <xs:element ref="view"/>
      </xs:sequence>
    </xs:complexType>
  </xs:element>
  <xs:element name="action">
    <xs:complexType>
      <xs:sequence>
        <xs:element ref="name"/>
        <xs:element minOccurs="0" ref="attribute-type"/>
        <xs:element minOccurs="0" ref="transaction"/>
        <xs:element minOccurs="0" ref="exclude"/>
        <xs:element minOccurs="0" ref="xhtml:style"/>
        <xs:element ref="view"/>
      </xs:sequence>
    </xs:complexType>
  </xs:element>
  <xs:element name="include" type="xs:NCName"/>
  <xs:element name="view" type="shtml"/>
  <xs:element name="view-iconified" type="shtml">
  </xs:element>
  <xs:complexType name="shtml">
    <xs:complexContent>
      <xs:extension base="xhtml:Block">
        <xs:attributeGroup ref="xhtml:attrs"/>
        <xs:attribute name="onload" type="xhtml:Script"/>
        <xs:attribute name="onunload" type="xhtml:Script"/>
      </xs:extension>
    </xs:complexContent>
  </xs:complexType>
  <xs:element name="redeem">
    <xs:complexType>
      <xs:attribute name="format" use="required" type="xs:NCName"/>
    </xs:complexType>
  </xs:element>
  <xs:element name="exclude">
    <xs:complexType>
      <xs:attribute name="selection"/>
    </xs:complexType>
  </xs:element>
  <xs:element name="feemaster" type="xs:anyURI"/>
  <xs:element name="gateway" type="xs:anyURI"/>
  <xs:element name="prefix" type="xs:anyURI"/>
  <xs:element name="selections">
    <xs:complexType>
      <xs:sequence>
        <xs:element maxOccurs="unbounded" ref="selection"/>
      </xs:sequence>
    </xs:complexType>
  </xs:element>
  <xs:element name="selection">
    <xs:complexType>
      <xs:sequence>
        <xs:element ref="name"/>
        <xs:element ref="filter"/>
      </xs:sequence>
      <xs:attribute name="id" use="required" type="xs:NCName"/>
    </xs:complexType>
  </xs:element>
  <xs:element name="filter" type="xs:string"/>
  <xs:element name="grouping">
    <xs:complexType>
      <xs:sequence>
        <xs:element ref="group"/>
      </xs:sequence>
    </xs:complexType>
  </xs:element>
  <xs:element name="group">
    <xs:complexType>
      <xs:sequence>
        <xs:element ref="consecutive_groups"/>
      </xs:sequence>
      <xs:attribute name="bitmask" use="required"/>
      <xs:attribute name="name" use="required" type="xs:NCName"/>
    </xs:complexType>
  </xs:element>
  <xs:element name="consecutive_groups">
    <xs:complexType/>
  </xs:element>
  <xs:element name="ordering">
    <xs:complexType>
      <xs:sequence>
        <xs:element maxOccurs="unbounded" ref="order"/>
      </xs:sequence>
    </xs:complexType>
  </xs:element>
  <xs:element name="order">
    <xs:complexType>
      <xs:sequence>
        <xs:element minOccurs="0" ref="byName"/>
        <xs:element maxOccurs="unbounded" ref="byValue"/>
      </xs:sequence>
      <xs:attribute name="bitmask" use="required"/>
      <xs:attribute name="name" use="required" type="xs:NCName"/>
    </xs:complexType>
  </xs:element>
  <xs:element name="byName">
    <xs:complexType>
      <xs:attribute name="field" use="required" type="xs:NCName"/>
    </xs:complexType>
  </xs:element>
  <xs:element name="byValue">
    <xs:complexType>
      <xs:attribute name="field" use="required" type="xs:NCName"/>
    </xs:complexType>
  </xs:element>
  <xs:element name="attribute-types">
    <xs:complexType>
      <xs:sequence>
        <xs:element maxOccurs="unbounded" ref="attribute-type"/>
      </xs:sequence>
    </xs:complexType>
  </xs:element>
  <xs:element name="attribute-type">
    <xs:complexType>
      <xs:sequence>
        <!-- name is not needed if the attribute is only used for selection -->
        <xs:element minOccurs="0" ref="name"/>
        <xs:element ref="origins"/>
        <xs:element minOccurs="0" ref="mapping"/>
      </xs:sequence>
      <xs:attribute name="as" type="xs:NCName"/>
      <xs:attribute name="id" use="required" type="xs:NCName"/>
      <xs:attribute name="oid" type="xs:NMTOKEN"/>
      <xs:attribute name="syntax" use="required" type="xs:NMTOKEN"/>
    </xs:complexType>
  </xs:element>
  <xs:element name="transaction">
    <xs:complexType>
      <xs:choice minOccurs="1" maxOccurs="1">
        <xs:element ref="ethereum"/>
      </xs:choice>
    </xs:complexType>
  </xs:element>
  <xs:element name="origins">
    <xs:complexType>
      <xs:all>
        <xs:element minOccurs="0" ref="ethereum"/>
        <xs:element minOccurs="0" ref="user-entry"/>
        <xs:element minOccurs="0" ref="token-id"/>
      </xs:all>
    </xs:complexType>
  </xs:element>
  <xs:element name="user-entry">
    <xs:complexType>
      <xs:attribute name="as" type="xs:NCName"/>
    </xs:complexType>
  </xs:element>
  <xs:element name="token-id">
    <xs:complexType>
      <xs:attribute name="as" type="xs:NCName"/>
      <xs:attribute name="bitmask"/>
    </xs:complexType>
  </xs:element>
  <xs:element name="ethereum">
    <xs:complexType>
      <xs:sequence>
        <xs:element minOccurs="0" name="inputs">
          <xs:complexType>
            <xs:sequence>
              <xs:element name="uint256">
                <xs:complexType >
                  <xs:attribute name="ref" use="required" type="xs:NCName"/>
                </xs:complexType>
              </xs:element>
            </xs:sequence>
          </xs:complexType>
        </xs:element>
      </xs:sequence>
      <xs:attribute name="contract" type="xs:IDREF"/>
      <xs:attribute name="function" type="xs:NCName"/>
      <xs:attribute name="as" type="xs:NCName"/>
    </xs:complexType>
  </xs:element>
  <xs:element name="mapping">
    <xs:complexType>
      <xs:sequence>
        <xs:element maxOccurs="unbounded" name="option">
          <xs:complexType>
            <xs:sequence>
              <xs:element maxOccurs="unbounded" name="value">
                <xs:complexType mixed="true">
                  <xs:attribute ref="xml:lang"/>
                </xs:complexType>
              </xs:element>
            </xs:sequence>
            <xs:attribute name="key" use="required" type="xs:integer"/>
          </xs:complexType>
        </xs:element>
      </xs:sequence>
    </xs:complexType>
  </xs:element>
</xs:schema>
