<?xml version="1.0" encoding="UTF-8"?>

<!DOCTYPE tokenscript  [
        <!ENTITY style SYSTEM "shared.css">
        ]>
<ts:token xmlns:ts="http://tokenscript.org/2019/05/tokenscript"
          xmlns="http://www.w3.org/1999/xhtml"
          xmlns:xml="http://www.w3.org/XML/1998/namespace"
          xsi:schemaLocation="http://tokenscript.org/2019/05/tokenscript ../../schema/tokenscript.xsd"
          xmlns:xsi="http://www.w3.org/2001/XMLSchema-instance"
          custodian="false"
>
    <ts:name xml:lang="en">DAI</ts:name>
    <ts:name xml:lang="zh">代幣</ts:name>
    <ts:contract interface="erc20" label="dai">
        <ts:address network="1"></ts:address>
    </ts:contract>
    <ts:cards>
        <ts:token-card>
            <ts:view-iconified/>
            <ts:view>
                <div id="dai"/>
            </ts:view>
        </ts:token-card>
        <ts:action>
            <ts:name xml:lang="en">Transfer to xDAI</ts:name>
            <ts:attribute-type id="amount" syntax="1.3.6.1.4.1.1466.115.121.1.36">
                <ts:name xml:lang="en">Amount in DAI</ts:name>
                <ts:name xml:lang="zh">代幣金額</ts:name>
                <ts:origins></ts:origins>
            </ts:attribute-type>
            <ts:view/>
        </ts:action>
    </ts:cards>
    <ts:attribute-types>
        <ts:attribute-type id="balance" syntax="1.3.6.1.4.1.1466.115.121.1.36">
            <ts:origins>
                <ts:ethereum-function name="balanceOf" contract="dai">
                    <ts:inputs>
                        <ts:uint256 ref="walletAddress"/>
                    </ts:inputs>
                </ts:ethereum-function>
            </ts:origins>
        </ts:attribute-type>
    </ts:attribute-types>
</ts:token>