<?xml version="1.0" encoding="UTF-8" standalone="no"?>
<!DOCTYPE token  [
        <!ENTITY TicketTemplate.en SYSTEM "TicketTemplate.en.shtml">
        <!ENTITY style SYSTEM "shared.css">
        ]>
<ts:token xmlns:ts="http://tokenscript.org/2019/10/tokenscript"
          xmlns="http://www.w3.org/1999/xhtml"
          xmlns:xml="http://www.w3.org/XML/1998/namespace"
          xsi:schemaLocation="http://tokenscript.org/2019/10/tokenscript http://tokenscript.org/2019/10/tokenscript.xsd"
          xmlns:xsi="http://www.w3.org/2001/XMLSchema-instance"
          custodian="false"
>
    <ts:name>
        <ts:plurals xml:lang="en">
            <ts:string quantity="one">An Example TokenScript Ticket </ts:string>
            <ts:string quantity="other">Some Example TokenScript Tickets</ts:string>
        </ts:plurals>
    </ts:name>

    <!-- need to make your own contract address -->
    <ts:contract name="Ticket Template" interface="erc721">
        <ts:address network="100">0x5e8c614cac6d140fbd5a454f41a1d5dc5da1a218</ts:address>
    </ts:contract>

    <ts:origins>
        <!-- Define the contract which holds the token that the user will use -->
        <ts:ethereum contract="Ticket Template">
        </ts:ethereum>
    </ts:origins>

    <ts:cards>
        <ts:token-card>
            <style type="text/css">&style;</style>
            <ts:view-iconified xml:lang="en">
                &TicketTemplate.en;
            </ts:view-iconified>
            <ts:view xml:lang="en">
                &TicketTemplate.en;
            </ts:view>
        </ts:token-card>
    </ts:cards>

    <!-- Attribute types define what's inside the Tokenscript -->
    <ts:attribute-types>
        <ts:attribute-type id="title" syntax="1.3.6.1.4.1.1466.115.121.1.24">
            <ts:name>
                <ts:string xml:lang="en">TokenScript Template</ts:string>
            </ts:name>
            <ts:origins>
                <ts:token-id bitmask="FFFFFFFFFFFFFFFFFFFFFFFFFFFFFFFFFFFFFF00000000000000000000000000" as="utf8">
                </ts:token-id>
            </ts:origins>
        </ts:attribute-type>

        <ts:attribute-type id="subtitle" oid="2.5.4.7" syntax="1.3.6.1.4.1.1466.115.121.1.15">
            <ts:name>
                <ts:string xml:lang="en">A blank template for Tokenscript</ts:string>
            </ts:name>
            <ts:origins>
                <ts:token-id bitmask="000000000000000000000000000000000000FF00000000000000000000000000" as="uint">
                    <ts:mapping>
                        <ts:option key="1">
                            <ts:value xml:lang="en">Shanghai</ts:value>
                        </ts:option>
                        <ts:option key="2">
                            <ts:value xml:lang="en">London</ts:value>
                        </ts:option>
                    </ts:mapping>
                </ts:token-id>
            </ts:origins>
        </ts:attribute-type>

        <ts:attribute-type id="footer" syntax="1.3.6.1.4.1.1466.115.121.1.15">
            <ts:name>
                <ts:string xml:lang="en">You can fill this in later</ts:string>
            </ts:name>
            <ts:origins>
                <ts:token-id bitmask="00000000000000000000000000000000000000FF000000000000000000000000" as="uint">
                    <ts:mapping>
                        <ts:option key="1">
                            <ts:value xml:lang="en">Shanghai Pudong Airport</ts:value>
                        </ts:option>
                        <ts:option key="2">
                            <ts:value xml:lang="en">London Heathrow Airport</ts:value>
                        </ts:option>
                    </ts:mapping>
                </ts:token-id>
            </ts:origins>
        </ts:attribute-type>

       
    </ts:attribute-types>
</ts:token>
